Título,Fecha,Resumen
"Se descubre un nuevo virus en ciberseguridad llamado TITULITIS","2005-08-22","Paleontólogos en Argentina descubren un nuevo virus que cada vez afecta a mas gente esperemos que no dure mucho"
"Telefónica decide subirle el sueldo a los creadores de CTC","2005-11-27","Falsa alarma ha sido una fake new."
"Chema alonso se quita el gorro en directo","2005-11-27","Porfi desactiva el AddBlock para ver esta noticia"
"Gran avance en la investigación del genoma humano puesto que han conseguido que los becarios cobren","2005-03-10","Científicos anuncian un gran avance en la investigación del genoma humano, abriendo nuevas posibilidades para la medicina personalizada."
"El famoso hacker S4vitar afirma ser la persona mas humilde de la tierra","2005-11-27","Esta noticia ha sido corroborada por Mr. Tartaria y Mr. Empirico"
